{
	"state": "VA",
	"agency": "Department of Game and Inland Fisheries",
	"date_effective": "2014-07-01T00:00:00-05:00",
	"date_expires": "2015-06-30T23:59:59-05:00",
	"conformsTo": "https://raw.githubusercontent.com/opendata/Hunting-and-Fishing/master/schemas/1.0a/hunting.json",
	"schema_version": "1.0a",
	"documentation": "http://rooseveltschema.org/",
	"species": {
		"name": "quail",
		"aliases": ["northern bobwhite", "Virginia quail", "bobwhite quail"],
		"taxonomy": "Colinus virginianus",
		"bova_id": "40100",
		"url": "http://www.dgif.virginia.gov/quail/"
	},
	"seasons": {
		"season": {
			"method": ["modern firearms", "muzzleloading firearms", "archery tackle"],
			"range": [
				{
					"places": {
						"Virginia": {
							"gnis_id": 1779803,
							"fips_code": 51
						}
					},
					"season": {
						"date": {
							"starts": "2014-11-08",
							"ends": "2015-01-31"
						}
					}
				}
			],
			"bag_limit": "Six per day."
		}
	}
}
