{
	"state": "VA",
	"agency": "Department of Game and Inland Fisheries",
	"date_effective": "2014-07-01T00:00:00-05:00",
	"date_expires": "2015-06-30T23:59:59-05:00",
	"conformsTo": "https://raw.githubusercontent.com/opendata/Hunting-and-Fishing/master/schemas/1.0a/hunting.json",
	"schema_version": "1.0a",
	"documentation": "http://rooseveltschema.org/",
	"species": {
		"name": "weasel",
		"members": [
			{
				"name": "least weasel",
				"taxonomy": "Mustela nivalis allegheniensis",
				"bova_id": "50040",
				"url": "http://www.dgif.virginia.gov/wildlife/information/?s=050040"
			},
			{
				"name": "long-tailed weasel",
				"taxonomy": "Mustela frenata noveboracensis",
				"bova_id": "50041",
				"url": "http://www.dgif.virginia.gov/wildlife/information/?s=050041"
			}
		]
	},
	"seasons": {
		"season": {
			"method": "traps",
			"range": [
				{
					"places": {
						"Virginia": {
							"gnis_id": 1779803,
							"fips_code": 51
						}
					},
					"season": {
						"date": {
							"starts": "2014-12-01",
							"ends": "2015-02-28"
						}
					}
				}
			]
		}
	}
}
